path,content
TechCorp_CloudServices_SLA_Agreement_2024,"SERVICE LEVEL AGREEMENT
This Service Level Agreement (""SLA"") is entered into on March 15, 2024, between TechCorp Solutions Inc., a Delaware corporation (""Provider""), and CloudFirst Enterprises LLC (""Customer"").

DEFINITIONS
Service Availability: The percentage of time during which the cloud services are operational and accessible.
Downtime: Any period when the services are unavailable or inaccessible to Customer.
Response Time: The time between service request submission and initial response from Provider.

SERVICE COMMITMENTS
Provider guarantees 99.9% uptime for all cloud infrastructure services during any calendar month.
Average response time for API calls shall not exceed 200 milliseconds under normal operating conditions.
Customer support response times: Critical issues within 1 hour, Standard issues within 4 hours.

REMEDIES
For each full percentage point below 99.9% availability, Customer receives 10% credit on monthly fees.
If response times exceed 500ms for more than 5 minutes in any hour, Customer receives 5% monthly credit.

MONITORING AND REPORTING
Provider will maintain real-time monitoring systems and provide monthly performance reports.
All metrics will be measured from Provider's monitoring systems located in primary data centers.

This SLA remains in effect for the duration of the underlying service agreement.

Executed by:
TechCorp Solutions Inc.
Sarah Mitchell, VP Operations
Date: March 15, 2024

CloudFirst Enterprises LLC
Robert Chen, CTO
Date: March 16, 2024"

DataSecure_Privacy_Policy_v3.2,"PRIVACY POLICY
DataSecure Analytics, Inc. (""Company"") Privacy Policy
Effective Date: January 1, 2024
Last Updated: February 28, 2024

INFORMATION COLLECTION
We collect information you provide directly, such as account details, usage preferences, and communication records.
Automatically collected data includes IP addresses, browser types, device information, and service interaction logs.
Third-party integrations may provide additional user behavior and demographic information with consent.

DATA USAGE
Personal information is used to provide services, improve user experience, and communicate service updates.
Aggregated, non-identifiable data may be used for analytics, research, and service enhancement.
We do not sell personal information to third parties for marketing purposes.

DATA PROTECTION
All data is encrypted in transit using TLS 1.3 and at rest using AES-256 encryption.
Access controls limit data access to authorized personnel only on a need-to-know basis.
Regular security audits and penetration testing ensure ongoing protection measures.

DATA RETENTION
Personal data is retained for the duration of active service plus 24 months.
Logs and analytics data are retained for 12 months unless legally required otherwise.
Upon account deletion, personal data is permanently removed within 30 days.

USER RIGHTS
Users may request access to, correction of, or deletion of their personal information.
Data portability requests will be fulfilled in standard formats within 30 days.
Marketing communications can be opted out of at any time.

CONTACT
For privacy concerns, contact: privacy@datasecure.com
Data Protection Officer: Jennifer Walsh, jwalsh@datasecure.com"

GlobalManufacturing_SupplyChain_Contract_Q2_2024,"SUPPLY CHAIN AGREEMENT
This Supply Chain Agreement is entered into between GlobalManufacturing Corp (""Buyer"") and PrecisionParts Ltd (""Supplier"") effective April 1, 2024.

SCOPE OF SERVICES
Supplier will provide automotive components including brake assemblies, suspension parts, and electrical harnesses.
All products must meet ISO 9001 quality standards and automotive industry specifications.
Delivery schedule: Weekly shipments every Tuesday, with 48-hour advance shipping notifications.

PRICING AND PAYMENT
Component pricing is fixed for initial 6-month term with quarterly price review thereafter.
Payment terms: Net 45 days from invoice date via electronic transfer.
Volume discounts apply: 5% for orders exceeding 10,000 units per month, 8% for orders exceeding 25,000 units.

QUALITY REQUIREMENTS
All components must pass incoming inspection with less than 0.1% defect rate.
Supplier maintains quality certifications including IATF 16949 and environmental compliance.
Batch tracking and traceability required for all delivered components.

LOGISTICS AND DELIVERY
Supplier responsible for packaging, labeling, and delivery to Buyer's distribution centers.
Delivery windows: 8 AM - 4 PM, Monday through Friday, with advance appointment scheduling.
Late delivery penalties: 2% of shipment value for each day beyond scheduled delivery.

RISK MANAGEMENT
Supplier maintains business continuity plans and alternative sourcing strategies.
Force majeure events must be reported within 24 hours with mitigation plans.
Insurance requirements: $5M general liability, $2M product liability coverage.

INTELLECTUAL PROPERTY
All custom tooling and specifications remain property of Buyer.
Supplier grants license to use necessary patents for component manufacturing.

This agreement shall remain in effect for 24 months with automatic renewal unless terminated.

GlobalManufacturing Corp
Michael Rodriguez, Supply Chain Director
Date: April 1, 2024

PrecisionParts Ltd
Amanda Foster, VP Sales
Date: April 2, 2024"

EduTech_StudentData_Management_Policy_2024,"STUDENT DATA MANAGEMENT POLICY
EduTech Learning Platform - Data Management and Protection Policy
Document Version: 2.1
Effective Date: August 15, 2024

SCOPE AND PURPOSE
This policy governs the collection, use, storage, and protection of student educational records and personal information.
Applies to all employees, contractors, and third-party service providers accessing student data.
Compliance with FERPA, COPPA, and state student privacy laws is mandatory.

DATA CLASSIFICATION
Educational Records: Grades, attendance, assignments, and academic progress information.
Personal Information: Names, addresses, contact details, and demographic information.
Behavioral Data: Learning patterns, platform usage, and engagement metrics.

COLLECTION PRINCIPLES
Data collection is limited to educational purposes and service improvement only.
Parental consent required for students under 13 years of age.
Students and parents have right to review and request corrections to educational records.

ACCESS CONTROLS
Role-based access ensures personnel see only data necessary for their functions.
Multi-factor authentication required for all system access.
Access logs maintained and reviewed monthly for unauthorized activity.

DATA SHARING
Educational records shared only with authorized school personnel and parents/students.
No data sharing with third parties for commercial purposes without explicit consent.
Research data must be de-identified and aggregated before external sharing.

SECURITY MEASURES
Data encrypted using industry-standard protocols during transmission and storage.
Regular security assessments and vulnerability testing conducted quarterly.
Incident response plan includes notification procedures for data breaches.

RETENTION AND DISPOSAL
Student records retained according to school district policies, typically 5-7 years post-graduation.
Inactive accounts and associated data purged after 2 years of non-use.
Secure data destruction protocols ensure complete removal of sensitive information.

COMPLIANCE MONITORING
Annual privacy training required for all staff handling student data.
Regular audits ensure ongoing compliance with applicable privacy regulations.
Privacy impact assessments conducted for new features or data uses.

Contact: Dr. Lisa Thompson, Chief Privacy Officer
Email: privacy@edutech-learning.com
Phone: (555) 123-4567"

FinanceFirst_Investment_Advisory_Agreement_2024,"INVESTMENT ADVISORY AGREEMENT
This Investment Advisory Agreement is entered into between FinanceFirst Advisors LLC (""Advisor"") and Madison Investment Group (""Client"") on May 20, 2024.

ADVISORY SERVICES
Advisor will provide comprehensive investment management and financial planning services.
Services include portfolio construction, asset allocation, risk assessment, and performance monitoring.
Regular portfolio reviews conducted quarterly with detailed performance reporting.

INVESTMENT AUTHORITY
Client grants Advisor discretionary authority to make investment decisions within agreed parameters.
Investment universe includes stocks, bonds, ETFs, mutual funds, and alternative investments as appropriate.
All trades executed through qualified broker-dealers with best execution practices.

FEE STRUCTURE
Management fee: 1.25% annually on assets under management, calculated and billed quarterly.
Performance fee: 15% of returns exceeding S&P 500 benchmark, calculated annually.
Additional fees may apply for specialized services such as tax planning or estate planning.

CLIENT RESPONSIBILITIES
Client must provide accurate financial information and promptly communicate changes in circumstances.
Investment objectives and risk tolerance should be reviewed and updated annually.
Client responsible for reviewing and approving investment policy statement.

RISK DISCLOSURE
All investments carry risk of loss, and past performance does not guarantee future results.
Diversification does not ensure profit or protect against loss in declining markets.
Alternative investments may have limited liquidity and higher volatility.

REGULATORY COMPLIANCE
Advisor is registered with the Securities and Exchange Commission as an investment advisor.
All activities conducted in accordance with Investment Advisers Act of 1940 and applicable regulations.
Form ADV Part 2 brochure provided annually with material updates.

CONFIDENTIALITY
All client information treated as confidential and shared only as necessary for service provision.
Third-party service providers bound by confidentiality agreements.
Client data protected through secure systems and access controls.

TERMINATION
Either party may terminate agreement with 30 days written notice.
Upon termination, Advisor will assist with orderly transfer of assets to new custodian or advisor.
Final fee calculation prorated to date of termination.

FinanceFirst Advisors LLC
Thomas Anderson, Managing Partner
Date: May 20, 2024

Madison Investment Group
Rebecca Martinez, Chief Investment Officer
Date: May 21, 2024"

HealthSystem_PatientCare_Standards_2024,"PATIENT CARE STANDARDS AND PROTOCOLS
Metropolitan Health System - Clinical Care Standards
Document ID: MHS-PCS-2024-001
Effective Date: June 1, 2024

PATIENT SAFETY PROTOCOLS
All patients must have proper identification verification using two unique identifiers.
Medication administration requires independent double-check for high-risk medications.
Fall risk assessments completed within 4 hours of admission with appropriate interventions.

CLINICAL DOCUMENTATION
Medical records must be completed within 24 hours of patient encounter.
All entries require electronic signature with timestamp and provider identification.
Critical values and abnormal results must be communicated and documented immediately.

INFECTION CONTROL
Hand hygiene compliance monitored with target rate of 95% or higher.
Personal protective equipment used according to transmission-based precautions.
Isolation procedures implemented within 2 hours of identification of infectious conditions.

EMERGENCY RESPONSE
Code team response time target: 3 minutes from activation to arrival.
Crash cart and emergency equipment checks performed daily and documented.
All staff required to maintain current CPR and emergency response certifications.

PATIENT COMMUNICATION
Patient rights and responsibilities communicated upon admission.
Informed consent obtained and documented prior to procedures and treatments.
Family involvement encouraged with respect for patient privacy preferences.

QUALITY MEASURES
Patient satisfaction scores monitored monthly with target of 4.5/5.0 or higher.
Medication error rates tracked with goal of less than 1 per 1000 patient days.
Hospital-acquired infection rates measured and benchmarked against national standards.

STAFF COMPETENCY
Annual competency assessments required for all clinical staff.
Continuing education requirements: 24 hours annually for nurses, 40 hours for physicians.
Specialty certifications maintained according to department and role requirements.

TECHNOLOGY STANDARDS
Electronic health record system used for all patient documentation.
Telemedicine capabilities available for remote consultations and monitoring.
Clinical decision support tools integrated to assist with diagnosis and treatment decisions.

Contact: Dr. Patricia Williams, Chief Medical Officer
Email: pwilliams@metrohealthsystem.org
Phone: (555) 987-6543"
